{"authentication_mode":"totp","cache_fields":4,"chunker_polynomial":"255a608adc8769","clock_synchronized":true,"installed_config_sha256":"995b3dfe8bf6fe61d2ebea18b53cdfc1874a6c6503ac8cc5e51fd20b0921d559","local_transition_evidence_sha256":"3080e6da1d1ba6d9f7d02d976fcdca5f458b29a720967b8a9619d38f03b4b243","otp_secret_key_present":true,"production_lock_retained":true,"provider_probe":"restic-cat-config","provider_requests":1,"repository_id":"d1faa9cd772dd13275b8d4db376c2bbba0b82a9415a28b0d03a8b17e37b7fb7e","source_commit":"280f58692b087e5d8f937848beee1c953e4a2859","timers_stopped":true,"transaction_sha256":"fde2f5f4a1ed940bb4ec9f298eca195df3493b50b6b9fa5132909aa954087da1","verified_at":"2026-08-27T04:32:37Z","version":1}
